{
  "$schema": "https://json-schema.org/draft/2020-12/schema",
  "$id": "https://kraenzle-ritter.ch/schemas/anton-import/0.5/schema.json",
  "title": "Anton Import Format",
  "description": "Canonical JSON shape for Anton's metadata.json import contract. v0.5 — adds an optional `format_normalization` list on `File`: what the producer's format rules (kraenzle-ritter/format-policy) did to the file before delivery, one entry per rule, shaped like Anton's `format-normalization` medium event (anton#654). Additive and optional. v0.4 — adds an optional `uuid` (and `match_by: \"uuid\"`) to inline authority specs, so actors/places/keywords carry a portable stable identity and a round-trip re-anchors them by uuid instead of collapsing same-label records (anton#231, rdf-bundle-reimport). Additive and optional — pre-v0.4 documents (and external producers such as agate) continue to validate unchanged. v0.3 added optional round-trip fidelity fields (`formset_id`, `term_values`, `_raw`, authority-host `notes`, media identity); v0.2 added `nara_category`; v0.2.1 added `Note.tracks`.",

  "type": "object",
  "additionalProperties": true,
  "required": ["version", "generator", "entries"],

  "properties": {
    "version": {
      "type": "string",
      "description": "Schema major.minor that this document targets (e.g. \"0.1\").",
      "pattern": "^[0-9]+\\.[0-9]+$"
    },
    "tenant": {
      "type": ["string", "null"],
      "description": "Anton tenant slug for which the import is intended (e.g. \"kba\", \"gosteli\"). Optional and nullable: producer-side pipelines (notably agate) often don't know the target tenant; the consumer-side importer overrides this with its own setting('slug') anyway.",
      "minLength": 1
    },
    "generator": {
      "type": "string",
      "description": "Identifier of the producing tool, including version. Convention: \"<package>@<version>\" (e.g. \"agate@0.1.0\", \"anton-excel-import@0.58.2\").",
      "minLength": 1
    },
    "defaults": {
      "$ref": "#/$defs/Defaults",
      "description": "Pipeline-wide defaults inherited by authority specs that don't set match_by/on_not_found."
    },
    "entries": {
      "type": "array",
      "description": "Top-level Anton-import records (collection / record entries forming the hierarchy).",
      "items": { "$ref": "#/$defs/Entry" }
    }
  },

  "$defs": {

    "Defaults": {
      "type": "object",
      "additionalProperties": true,
      "properties": {
        "match_by":     { "$ref": "#/$defs/MatchBy" },
        "on_not_found": { "$ref": "#/$defs/OnNotFound" }
      }
    },

    "MatchBy": {
      "type": "string",
      "description": "Strategy for matching an inline authority spec against an existing DB authority record. `uuid` (v0.4) matches on the portable stable id and creates the record with that uuid when absent — used by the Anton-native round-trip.",
      "enum": ["uuid", "label", "label.de", "label.fr", "label.en", "label.it", "alternative_names"]
    },

    "OnNotFound": {
      "type": "string",
      "description": "Policy applied when the inline authority spec does not match any existing DB record.",
      "enum": ["create", "error", "skip"]
    },

    "Entry": {
      "oneOf": [
        { "$ref": "#/$defs/CollectionEntry" },
        { "$ref": "#/$defs/RecordEntry" }
      ]
    },

    "CollectionEntry": {
      "type": "object",
      "additionalProperties": true,
      "required": ["uuid", "type", "title"],
      "properties": {
        "uuid":                 { "type": "string", "format": "uuid" },
        "type":                 { "const": "collection" },
        "level_of_description": { "$ref": "#/$defs/LevelOfDescription" },
        "identifier":           { "type": "string" },
        "identifier_old":       { "type": "string" },
        "title":                { "$ref": "#/$defs/MultilingualString" },
        "parent":               { "$ref": "#/$defs/ObjectReference" },
        "extent_cm":            { "type": "string" },
        "object_count":         { "type": ["string", "integer", "null"] },
        "vacat":                { "type": ["boolean", "integer"] },
        "private":              { "type": ["boolean", "integer"] },
        "release_year":         { "type": ["integer", "null"] },
        "events":               { "type": "array", "items": { "$ref": "#/$defs/Event" } },
        "notes":                { "type": "array", "items": { "$ref": "#/$defs/Note" } },
        "languages":            { "type": "array", "items": { "$ref": "#/$defs/LanguageCode" } },
        "keywords":             { "type": "array", "items": { "$ref": "#/$defs/AuthorityReference" } },
        "places":               { "type": "array", "items": { "$ref": "#/$defs/AuthorityReference" } },
        "formset_id":           { "type": ["integer", "string", "null"], "description": "Which ObjectForm/Objectformtype produced the record — governs which fields exist. Round-trip fidelity (v0.3)." },
        "term_values":          { "type": "array", "description": "termselect values (object_term_values). Round-trip fidelity (v0.3).", "items": { "$ref": "#/$defs/TermValue" } },
        "_raw":                 { "type": "object", "description": "Opaque snapshot of exact pre-transform column values for byte-fidelity restore. Consumer-defined; non-Anton producers SHOULD omit. Round-trip fidelity (v0.3)." }
      }
    },

    "RecordEntry": {
      "type": "object",
      "additionalProperties": true,
      "required": ["uuid", "type", "title"],
      "properties": {
        "uuid":                 { "type": "string", "format": "uuid" },
        "type":                 { "const": "record" },
        "level_of_description": { "$ref": "#/$defs/LevelOfDescription" },
        "identifier":           { "type": "string" },
        "identifier_old":       { "type": "string" },
        "title":                { "$ref": "#/$defs/MultilingualString" },
        "parent":               { "$ref": "#/$defs/ObjectReference" },
        "extent_cm":            { "type": "string" },
        "object_count":         { "type": ["string", "integer", "null"] },
        "vacat":                { "type": ["boolean", "integer"] },
        "private":              { "type": ["boolean", "integer"] },
        "release_year":         { "type": ["integer", "null"] },
        "events":               { "type": "array", "items": { "$ref": "#/$defs/Event" } },
        "notes":                { "type": "array", "items": { "$ref": "#/$defs/Note" } },
        "languages":            { "type": "array", "items": { "$ref": "#/$defs/LanguageCode" } },
        "keywords":             { "type": "array", "items": { "$ref": "#/$defs/AuthorityReference" } },
        "places":               { "type": "array", "items": { "$ref": "#/$defs/AuthorityReference" } },
        "files":                { "type": "array", "items": { "$ref": "#/$defs/File" } },
        "nara_category":        { "$ref": "#/$defs/NaraCategory" },
        "formset_id":           { "type": ["integer", "string", "null"], "description": "Which ObjectForm/Objectformtype produced the record — governs which fields exist. Round-trip fidelity (v0.3)." },
        "term_values":          { "type": "array", "description": "termselect values (object_term_values). Round-trip fidelity (v0.3).", "items": { "$ref": "#/$defs/TermValue" } },
        "_raw":                 { "type": "object", "description": "Opaque snapshot of exact pre-transform column values for byte-fidelity restore. Consumer-defined; non-Anton producers SHOULD omit. Round-trip fidelity (v0.3)." }
      }
    },

    "TermValue": {
      "type": "object",
      "description": "A termselect value: a controlled term chosen for a specific antonfield (e.g. Reproduktionsbestimmungen). `antonfield` names the field; the term is referenced by `term_id` (same-tenant) and/or `taxonomy` + `name` (portable). Round-trip fidelity (v0.3).",
      "additionalProperties": true,
      "required": ["antonfield"],
      "properties": {
        "antonfield": { "type": "string", "minLength": 1 },
        "term_id":    { "type": "integer", "minimum": 1 },
        "taxonomy":   { "type": "string", "minLength": 1 },
        "name":       { "type": "string", "minLength": 1 }
      },
      "anyOf": [
        { "required": ["term_id"] },
        { "required": ["name"] }
      ]
    },

    "NaraCategory": {
      "type": "string",
      "description": "NARA-standard file format category. Producers emit the raw NARA category; the consumer (Anton) maps it to its tenant `object_types` taxonomy. The 16 categories cover NARA's File Format Risk Assessment vocabulary as of 2024.",
      "enum": [
        "Audio",
        "Video",
        "Cinema",
        "StillImage",
        "Geospatial",
        "NavCharts",
        "DesignVector",
        "Textual",
        "Spreadsheets",
        "Presentation",
        "Code",
        "Email",
        "Web",
        "Databases",
        "StructuredData",
        "Calendars"
      ]
    },

    "LevelOfDescription": {
      "type": "string",
      "description": "ISAD(G) level of description.",
      "enum": ["collection", "recordgroup", "fonds", "series", "class", "file", "item"]
    },

    "ObjectReference": {
      "type": "object",
      "description": "Reference to an existing AntonObject (parent, etc.). UUID is primary; identifier and id only resolve if the target already exists in DB. Resolution order: uuid > identifier > id.",
      "additionalProperties": false,
      "properties": {
        "uuid":       { "type": "string", "format": "uuid" },
        "identifier": { "type": "string", "minLength": 1 },
        "id":         { "type": "integer", "minimum": 1 }
      },
      "anyOf": [
        { "required": ["uuid"] },
        { "required": ["identifier"] },
        { "required": ["id"] }
      ]
    },

    "MultilingualString": {
      "type": "object",
      "description": "Multilingual content keyed by ISO-639-1 two-letter language codes (de, fr, en, it, ...). Values are the localised strings.",
      "minProperties": 1,
      "additionalProperties": false,
      "patternProperties": {
        "^[a-z]{2}$": { "type": "string" }
      }
    },

    "LanguageCode": {
      "type": "string",
      "description": "ISO-639-2 three-letter language code as stored in Anton's languages.name column (ger, fre, eng, lat, ...).",
      "pattern": "^[a-z]{3}$"
    },

    "AuthorityReference": {
      "description": "Reference to an Actor, Place, or Keyword. Either id-form (existing DB record by id) or inline-form (match-or-create). The two forms MUST NOT be mixed.",
      "oneOf": [
        { "$ref": "#/$defs/AuthorityIdReference" },
        { "$ref": "#/$defs/AuthorityInlineSpec" }
      ]
    },

    "AuthorityIdReference": {
      "type": "object",
      "additionalProperties": false,
      "required": ["id"],
      "properties": {
        "id": { "type": "integer", "minimum": 1 }
      }
    },

    "AuthorityInlineSpec": {
      "type": "object",
      "additionalProperties": true,
      "required": ["label"],
      "not": { "required": ["id"] },
      "properties": {
        "uuid":            { "type": "string", "format": "uuid", "description": "Portable stable id of the authority (v0.4). When present the round-trip re-anchors by uuid; use with `match_by: \"uuid\"`." },
        "label":           { "$ref": "#/$defs/MultilingualString" },
        "type":            { "type": "string" },
        "subtype":         { "type": "string" },
        "match_by":        { "$ref": "#/$defs/MatchBy" },
        "on_not_found":    { "$ref": "#/$defs/OnNotFound" },
        "alternative_names": { "type": "array", "items": { "type": "string" } },
        "date_start":      { "type": "string" },
        "date_end":        { "type": "string" },
        "city":            { "type": "string" },
        "state":           { "type": "string" },
        "country_code":    { "type": "string" },
        "address":         { "type": "string" },
        "notes":           { "type": "array", "description": "Notes on the authority record itself (e.g. actor biography / bioghist). Reuses the object Note shape. Round-trip fidelity (v0.3).", "items": { "$ref": "#/$defs/Note" } }
      }
    },

    "Event": {
      "type": "object",
      "additionalProperties": true,
      "required": ["type"],
      "properties": {
        "type": {
          "type": "string",
          "description": "Eventtype name (matches Anton's Eventtype enum: creation, acquisition, reproduction, digitisation, reception, performance, provenance, preservation, engravation, writing, coloring, edition, production, text_author, ingest, other).",
          "enum": [
            "creation", "acquisition", "reproduction", "digitisation",
            "reception", "performance", "provenance", "preservation",
            "engravation", "writing", "coloring", "edition", "production",
            "text_author", "ingest", "other"
          ]
        },
        "actor":      { "$ref": "#/$defs/AuthorityReference" },
        "place":      { "$ref": "#/$defs/AuthorityReference" },
        "details":    { "type": "string" },
        "date_start": { "type": "string" },
        "date_end":   { "type": "string" },
        "date_start_ca": { "type": ["boolean", "integer"] },
        "date_end_ca":   { "type": ["boolean", "integer"] }
      }
    },

    "Note": {
      "type": "object",
      "additionalProperties": true,
      "required": ["type", "locale", "text"],
      "properties": {
        "type": {
          "type": "string",
          "description": "Notetype name (e.g. scopecontent, archivists_notes, general_note, internal_note, condition_of_access, provenance, ...).",
          "minLength": 1
        },
        "locale": {
          "type": "string",
          "description": "ISO-639-1 two-letter locale code for the note text.",
          "pattern": "^[a-z]{2}$"
        },
        "text": {
          "type": "string",
          "minLength": 1
        },
        "tracks": {
          "type": "array",
          "description": "Optional time-stamped track entries — used by movie_content / audio_content notes that carry a per-timestamp transcript or scene description. Producers MAY omit; consumers MUST treat as additive (pre-tracks Notes remain valid).",
          "items": {
            "type": "object",
            "additionalProperties": true,
            "required": ["timestamp", "content"],
            "properties": {
              "timestamp": {
                "type": "string",
                "description": "Timecode within the parent media — typically HH:MM:SS or HH:MM:SS.mmm. Format is producer-defined; consumers SHOULD treat as opaque text.",
                "minLength": 1
              },
              "content": {
                "type": "string",
                "description": "Free-text track content at this timestamp (transcript line, scene description, OCR snippet, …).",
                "minLength": 1
              }
            }
          }
        }
      }
    },

    "File": {
      "type": "object",
      "additionalProperties": true,
      "required": ["name", "mime_type", "md5sum"],
      "properties": {
        "uuid":       { "type": "string", "format": "uuid" },
        "name":       { "type": "string", "minLength": 1 },
        "file_path":  { "type": "string" },
        "mime_type":  { "type": "string", "minLength": 1 },
        "md5sum":     { "type": "string", "pattern": "^[a-f0-9]{32}$" },
        "size_bytes":     { "type": "integer", "minimum": 0 },
        "pronom_id":      { "type": "string" },
        "nara_risk":      { "type": "string", "enum": ["low", "moderate", "high", "unknown"] },
        "nara_category":  { "$ref": "#/$defs/NaraCategory" },
        "exiftool":       { "type": "object" },
        "collection_name":       { "type": "string", "description": "Anton media collection (image / audio / video / application). Round-trip fidelity (v0.3)." },
        "file_name":             { "type": "string", "description": "Stored original filename (may differ from display `name`). Round-trip fidelity (v0.3)." },
        "generated_conversions": { "type": "object", "description": "Per-derivative conversion state (e.g. { \"web\": { \"width\": 800, \"height\": 600 }, \"thumb\": true }), so the consumer can restore or re-drive conversions. Round-trip fidelity (v0.3)." },
        "av_duration_seconds":   { "type": ["number", "string"], "description": "Audio/video duration in seconds. Round-trip fidelity (v0.3)." },
        "format_normalization":  {
          "type": "array",
          "description": "What the producer's format rules did to this file before delivery, one entry per rule that applied (v0.5, anton#654). `md5sum` above is the checksum of the file as delivered to Anton, i.e. after a conversion; the checksum of the file the producer received is in `details.before`.",
          "items": { "$ref": "#/$defs/FormatNormalization" }
        }
      }
    },

    "FormatNormalization": {
      "type": "object",
      "additionalProperties": true,
      "required": ["rule", "status", "details"],
      "description": "One rule's outcome, shaped like Anton's medium event `format-normalization` (MediumEvent::record($medium, 'format-normalization', status, phase, details)).",
      "properties": {
        "rule":    { "type": "string", "minLength": 1, "description": "Rule key in kraenzle-ritter/format-policy (e.g. \"tiff_zip\")." },
        "status":  { "type": "string", "enum": ["ok", "failed", "info"], "description": "`ok`: the file was converted. `failed` and `info`: the received file was kept." },
        "phase":   { "type": "string", "minLength": 1, "description": "Policy phase; `preingest` for conversions before delivery." },
        "details": {
          "type": "object",
          "additionalProperties": true,
          "description": "Rule details as format-policy records them: `source`, `tools`, `before`/`after` ({md5, sha512, size, pronom, mime}), `verification`, `original`.",
          "properties": {
            "before": { "$ref": "#/$defs/FileFixity" },
            "after":  { "$ref": "#/$defs/FileFixity" }
          }
        }
      }
    },

    "FileFixity": {
      "type": "object",
      "additionalProperties": true,
      "properties": {
        "md5":    { "type": "string", "pattern": "^[a-f0-9]{32}$" },
        "sha512": { "type": "string", "pattern": "^[a-f0-9]{128}$" },
        "size":   { "type": "integer", "minimum": 0 },
        "pronom": { "type": ["string", "null"] },
        "mime":   { "type": ["string", "null"] }
      }
    }
  }
}
